Date,Prize,From,Prize_JP,From_JP
2013XXXX,CSJ Chemistry Festa Poster Prize,Chemical Society of Japan (CSJ),CSJ化学フェスタ ポスター賞,日本化学会
20150401,JSPS DC1 (no interview),Japan Society for the Promotion of Science (JSPS),DC1 採用,日本学術振興会（JSPS)
20180307,Merit Award (4 awardees out of 40 candidates),University of Tokyo Leading Graduate Program MERIT,MERIT賞 (学年40人から優秀者4人),東京大学リーディング大学院MERIT
201803XX,Cum Laude,University of Tokyo Department of Engineering,工学系研究科長賞(専攻内で最優秀賞),東京大学
2019XXXX,SPD Interview Declined,Japan Society for the Promotion of Science (JSPS),SPD面接辞退,日本学術振興会（JSPS)
20190401,Special Postdoctoral Researcher,RIKEN,基礎科学特別研究員 採用,理化学研究所
201903,,,桜舞賞,理化学研究所
202003,,,基礎科学特別研究員 成果報告会 優秀賞,理化学研究所
